{
  "artifact_type": "TestPlan",
  "schema_version": "v1",
  "test_plan_id": "test-plan-expense-status",
  "change_request_id": "change-request-expense-status",
  "project_id": "visiondemo",
  "status": "ready",
  "test_cases": [
    {
      "test_case_id": "expense-empty-status-api",
      "title": "Blank status returns all expenses",
      "level": "api",
      "execution_mode": "deterministic",
      "business_rule_refs": ["rule-empty-status-all"],
      "acceptance_criteria_refs": ["criterion-empty-status-count"],
      "preconditions": ["Default seed data is loaded"],
      "steps": ["GET /expense/api/search?status="],
      "expected_results": ["Four seeded expenses are returned"],
      "test_data_refs": ["expense-default-seed"]
    }
  ]
}
